<?xml version="1.0" encoding="UTF-8"?>
<!DOCTYPE order SYSTEM 'bonanza.dtd'>
<order type="takeout">
    <customer>Edwin</customer>
    <burger>
        <patty type="beef"/>
        <cheeses top="goat" bottom="jack"/>
        <topping type="bacon"/>
        <topping type="egg"/>
        <topping type="shrooms"/>
        <sauce type="mayo"/>
        <sauce type="fksauce"/>
    </burger>
</order>